<?xml version="1.0" encoding="UTF-8" ?>
<class name="PhysicsShapeCollisionResult3D" inherits="RefCounted" api_type="core" xmlns:xsi="http://www.w3.org/2001/XMLSchema-instance" xsi:noNamespaceSchemaLocation="../class.xsd">
	<brief_description>
		Stores the collision points of a shape intersection query.
	</brief_description>
	<description>
		This class contains the contact points computed by [method PhysicsDirectSpaceState3D.collide_shape_typed].
		Each collision is represented as a pair of points: one on the queried shape and one on the colliding shape.
	</description>
	<tutorials>
	</tutorials>
	<methods>
		<method name="get_point_on_colliding_shape" qualifiers="const">
			<return type="Vector3" />
			<param index="0" name="collision_index" type="int" default="0" />
			<description>
				Returns the collision point on the colliding shape for the collision at the given index.
			</description>
		</method>
		<method name="get_point_on_queried_shape" qualifiers="const">
			<return type="Vector3" />
			<param index="0" name="collision_index" type="int" default="0" />
			<description>
				Returns the collision point on the queried shape for the collision at the given index.
			</description>
		</method>
	</methods>
	<members>
		<member name="collision_count" type="int" setter="" getter="get_collision_count" default="0">
			The number of shapes that collide with the queried shape.
		</member>
		<member name="max_collisions" type="int" setter="set_max_collisions" getter="get_max_collisions" default="32">
			The maximum number of collisions this object can store.
		</member>
	</members>
</class>
