<?xml version="1.0" encoding="UTF-8" ?>
<class name="VisualScriptPropertyGet" inherits="VisualScriptNode" version="4.0" xmlns:xsi="http://www.w3.org/2001/XMLSchema-instance" xsi:noNamespaceSchemaLocation="../../../doc/class.xsd">
	<brief_description>
	</brief_description>
	<description>
	</description>
	<tutorials>
	</tutorials>
	<methods>
	</methods>
	<members>
		<member name="base_script" type="String" setter="set_base_script" getter="get_base_script">
		</member>
		<member name="base_type" type="StringName" setter="set_base_type" getter="get_base_type" default="@&quot;Object&quot;">
		</member>
		<member name="basic_type" type="int" setter="set_basic_type" getter="get_basic_type" enum="Variant.Type">
		</member>
		<member name="index" type="StringName" setter="set_index" getter="get_index">
		</member>
		<member name="node_path" type="NodePath" setter="set_base_path" getter="get_base_path">
		</member>
		<member name="property" type="StringName" setter="set_property" getter="get_property" default="@&quot;&quot;">
		</member>
		<member name="set_mode" type="int" setter="set_call_mode" getter="get_call_mode" enum="VisualScriptPropertyGet.CallMode" default="0">
		</member>
	</members>
	<constants>
		<constant name="CALL_MODE_SELF" value="0" enum="CallMode">
		</constant>
		<constant name="CALL_MODE_NODE_PATH" value="1" enum="CallMode">
		</constant>
		<constant name="CALL_MODE_INSTANCE" value="2" enum="CallMode">
		</constant>
	</constants>
</class>
